{
  "contract": "aifit.control-export",
  "version": "1.0.0",
  "enforcement": "recommended-not-enforced",
  "disclaimer": "Recommendations generated by AI Fit Teams from one assessment. Nothing here is an enforced control, a compliance attestation, or a measurement. Each item needs a human decision before it is adopted.",
  "source": {
    "product": "AI Fit Teams",
    "generatedAt": "2026-10-27T12:00:00.000Z",
    "assessment": {
      "id": "asm_example1",
      "rootId": "asm_example1",
      "version": 1
    },
    "inputHash": "1e5a52591a9acef466fa05f2fdaaac982771e41b406f9a022e770de53a7d67c1",
    "engines": {
      "blueprint": "1.0.0",
      "decision": "1.0.0",
      "decisionRules": "decision-rules.v1",
      "suitabilityRubric": "ARK suitability rubric v0.1",
      "modelCatalogAsOf": "2026-09-14"
    }
  },
  "workload": {
    "name": "Support ticket triage and refund handling",
    "verdict": "automate-bounded",
    "outcome": "build_ai",
    "pattern": "bounded-agent",
    "dataClasses": [
      "pii",
      "financial"
    ],
    "regulated": [
      "ccpa"
    ],
    "riskLevel": "severe"
  },
  "governanceRequirements": [
    {
      "id": "sec-01",
      "requirement": "Redact or tokenise sensitive fields before the prompt is constructed.",
      "rationale": "Once data is in a provider request it is out of your control boundary, regardless of the retention promise in the contract.",
      "severity": "blocking",
      "source": "security-rubric",
      "verification": {
        "method": "Control scans outbound prompt payloads for configured sensitive patterns and alerts on matches.",
        "owner": "customer"
      }
    },
    {
      "id": "sec-02",
      "requirement": "Pin an allow-list of approved providers, models and regions; deny everything else at the gateway.",
      "rationale": "Shadow AI is the common path by which regulated data reaches an unreviewed endpoint.",
      "severity": "blocking",
      "source": "security-rubric",
      "verification": {
        "method": "Control flags any model ID or destination not on the allow-list.",
        "owner": "customer"
      }
    },
    {
      "id": "sec-04",
      "requirement": "Scope every tool credential to the narrowest permission that works. One service account per tool, not one per agent.",
      "rationale": "Excessive agent privilege is the most consistently reported blocker to production agent deployment.",
      "severity": "blocking",
      "source": "security-rubric",
      "verification": {
        "method": "Control records which credential performed each action and flags use outside declared scope.",
        "owner": "customer"
      }
    },
    {
      "id": "sec-05",
      "requirement": "Human approval gate on: Issue refund (above the stated value ceilings).",
      "rationale": "The cost of a wrong autonomous action here exceeds the labour saved by removing the approval step.",
      "severity": "blocking",
      "source": "security-rubric",
      "verification": {
        "method": "Control asserts an approval record exists for every gated action and alerts on any that executed without one.",
        "owner": "customer"
      }
    },
    {
      "id": "sec-06",
      "requirement": "Treat all retrieved and user-supplied content as untrusted data, never as instructions. Test with an adversarial injection suite in CI.",
      "rationale": "Prompt injection is not a prompt-engineering problem; it is an architecture problem solved by privilege separation.",
      "severity": "blocking",
      "source": "security-rubric",
      "verification": {
        "method": "Control correlates injection-signature detections with subsequent tool calls.",
        "owner": "customer"
      }
    },
    {
      "id": "sec-07",
      "requirement": "Log every model call with workload, user, model, tokens, cost, latency, outcome and any action taken.",
      "rationale": "Without attribution you cannot answer \"who spent this, on what, and what did it do\" — the question that arrives first in any incident or audit.",
      "severity": "recommended",
      "source": "security-rubric",
      "verification": {
        "method": "This is the ARC Control ingest contract; coverage is measurable as a percentage of known traffic.",
        "owner": "customer"
      }
    },
    {
      "id": "sec-08",
      "requirement": "Per-workload spend ceiling with an automatic circuit breaker.",
      "rationale": "An agent loop failure is a financial incident that runs at machine speed. Rate limits are a security control, not a billing preference.",
      "severity": "blocking",
      "source": "security-rubric",
      "verification": {
        "method": "Control enforces the budget and records every trip of the breaker.",
        "owner": "customer"
      }
    },
    {
      "id": "decision.1",
      "requirement": "Confirm in writing that your vendor agreement covers this data class, on the plan you use.",
      "rationale": "Required by the deterministic decision rules for this workload.",
      "severity": "recommended",
      "source": "decision-rules",
      "verification": {
        "method": "Confirm in the launch review that this is in place.",
        "owner": "customer"
      }
    },
    {
      "id": "decision.2",
      "requirement": "Keep a person reviewing outputs until you have measured the error rate on real examples.",
      "rationale": "Required by the deterministic decision rules for this workload.",
      "severity": "recommended",
      "source": "decision-rules",
      "verification": {
        "method": "Confirm in the launch review that this is in place.",
        "owner": "customer"
      }
    },
    {
      "id": "decision.3",
      "requirement": "Do not paste data into a tool whose data-retention terms you have not read.",
      "rationale": "Required by the deterministic decision rules for this workload.",
      "severity": "recommended",
      "source": "decision-rules",
      "verification": {
        "method": "Confirm in the launch review that this is in place.",
        "owner": "customer"
      }
    },
    {
      "id": "eval.1",
      "requirement": "Meet \"Task accuracy on the golden set\" at >= 97% before launch.",
      "rationale": "A launch-blocking acceptance criterion from the evaluation plan.",
      "severity": "blocking",
      "source": "evaluation-plan",
      "verification": {
        "method": "Human-labelled holdout of 240 real examples, sampled across the full input distribution — not the easy ones.",
        "owner": "customer"
      }
    },
    {
      "id": "eval.2",
      "requirement": "Meet \"Accuracy vs. the human baseline\" at Error rate <= 4.0% (today's human rate) before launch.",
      "rationale": "A launch-blocking acceptance criterion from the evaluation plan.",
      "severity": "blocking",
      "source": "evaluation-plan",
      "verification": {
        "method": "Same golden set, scored against how the current process actually performs.",
        "owner": "customer"
      }
    },
    {
      "id": "eval.3",
      "requirement": "Meet \"Schema validity\" at >= 99.5% first-pass before launch.",
      "rationale": "A launch-blocking acceptance criterion from the evaluation plan.",
      "severity": "blocking",
      "source": "evaluation-plan",
      "verification": {
        "method": "Validator rejection rate at the gateway.",
        "owner": "customer"
      }
    },
    {
      "id": "eval.4",
      "requirement": "Meet \"Unauthorised action rate\" at 0 — any occurrence is a launch blocker before launch.",
      "rationale": "A launch-blocking acceptance criterion from the evaluation plan.",
      "severity": "blocking",
      "source": "evaluation-plan",
      "verification": {
        "method": "Control compares every executed action against the declared tool allow-list and approval records.",
        "owner": "customer"
      }
    },
    {
      "id": "eval.5",
      "requirement": "Meet \"Loop containment\" at p99 turns per outcome within the configured cap before launch.",
      "rationale": "A launch-blocking acceptance criterion from the evaluation plan.",
      "severity": "blocking",
      "source": "evaluation-plan",
      "verification": {
        "method": "Control turn distribution per trace. A long tail here is a cost incident forming.",
        "owner": "customer"
      }
    },
    {
      "id": "eval.6",
      "requirement": "Meet \"Adversarial injection resistance\" at 0 successful tool invocations from injected instructions before launch.",
      "rationale": "A launch-blocking acceptance criterion from the evaluation plan.",
      "severity": "blocking",
      "source": "evaluation-plan",
      "verification": {
        "method": "Red-team suite run in CI on every prompt or tool change.",
        "owner": "customer"
      }
    }
  ],
  "policySuggestions": [
    {
      "id": "approve-consequential-actions",
      "title": "Human approval for consequential actions",
      "rule": {
        "kind": "require_human_approval",
        "actions": [
          "Salesforce:Issue refund"
        ]
      },
      "rationale": "These actions are costly or irreversible. A person approves each call before it runs.",
      "status": "suggested"
    },
    {
      "id": "redact-sensitive-data",
      "title": "Redact sensitive data before prompts are built",
      "rule": {
        "kind": "redact_data_classes",
        "dataClasses": [
          "pii",
          "financial"
        ]
      },
      "rationale": "Sensitive data classes are in scope; tokenise or redact them before any model sees them.",
      "status": "suggested"
    },
    {
      "id": "monthly-spend-cap",
      "title": "Monthly model spend cap",
      "rule": {
        "kind": "monthly_spend_cap",
        "usd": 216,
        "basis": "heuristic"
      },
      "rationale": "1.5× the upper estimate of monthly run cost (heuristic). Revisit once real spend is measured.",